"DESCRIPTION","DURATION IN MS","NAME","PARENT SUITE","START TIME","STATUS","STOP TIME","SUB SUITE","SUITE","TEST CLASS","TEST METHOD"
"","16441","CP01_Acceso a la pantalla de edición","","2025-12-18","passed","2025-12-18","","58366 Modificación de pregunta por actividad o subactividad","",""
"","13323","CP02_Estructura de la pantalla / modal de edición","","2025-12-18","passed","2025-12-18","","58366 Modificación de pregunta por actividad o subactividad","",""
"","11504","CP05_Rechazo por extensión incorrecta","","2025-12-18","passed","2025-12-18","","58249 Cargue Inicial de Archivo Jurados","",""
"","8022","CP04_Validar campo orden pregunta numérico","","2025-12-18","passed","2025-12-18","","58363 Creación de pregunta por actividad o subactividad","",""
"","10748","CP01_Visualización del botón y apertura del modal de confirmación de eliminación","","2025-12-18","passed","2025-12-18","","58296 Eliminar etapa del proceso electoral","",""
"","12310","CP02_Confirmación de eliminación exitosa","","2025-12-18","passed","2025-12-18","","58296 Eliminar etapa del proceso electoral","",""
"","7839","CP06_Listado de alertas y columnas","","2025-12-18","passed","2025-12-18","","58127 Creación de envío de alertas o notificación","",""
"","12587","CP01_Acceso a la pantalla","","2025-12-18","passed","2025-12-18","","58378 Creación de sub - actividad para una actividad","",""
"","13798","CP10_Validar que el campo Estado sea obligatorio","","2025-12-18","passed","2025-12-18","","58379 Modificación de sub - actividad para una actividad","",""
"","9820","CP02_Validar estructura de la pantalla Visualizar subactividades","","2025-12-18","passed","2025-12-18","","62774 Visualizar Subactividades asociadas a una Actividad","",""
"","18452","CP4_Validación de campos del formulario al editar registro de Etapas del proceso","","2025-12-18","passed","2025-12-18","","58294 Modificación de etapa del proceso","",""
"","6624","CP4_Login usuario inexistente o inactivo","","2025-12-18","passed","2025-12-18","","57775 Autenticación de Usuarios mediante Login","",""
"","15340","CP10_Programación de envío futuro","","2025-12-18","passed","2025-12-18","","58127 Creación de envío de alertas o notificación","",""
"","18521","CP04_Validar errores y validaciones en la pantalla","","2025-12-18","passed","2025-12-18","","58140 Modificación de envío de alertas o notificación","",""
"","18052","CP04_Comportamiento de listas desplegables dependientes","","2025-12-18","passed","2025-12-18","","58366 Modificación de pregunta por actividad o subactividad","",""
"","51128","CP06_Validad Funcionalidad de Guardar flujo completo","","2025-12-18","passed","2025-12-18","","57827 Configurar fechas por etapas","",""
"","14075","CP12_Validar comportamiento botón Cancelar y botón Cerrar del form","","2025-12-18","passed","2025-12-18","","58379 Modificación de sub - actividad para una actividad","",""
"","9869","CP03_Validar cuando se selecciona NO en la confirmación al momento de eliminar el registro","","2025-12-18","passed","2025-12-18","","58380 Eliminar sub - actividad para una actividad","",""
