"DESCRIPTION","DURATION IN MS","NAME","PARENT SUITE","START TIME","STATUS","STOP TIME","SUB SUITE","SUITE","TEST CLASS","TEST METHOD"
"","11559","CP9_Validar que el campo Etapa sea obligatorio","","2025-12-18","passed","2025-12-18","","58379 Modificación de sub - actividad para una actividad","",""
"","9509","CP02_Validar estructura de la pantalla Visualizar subactividades","","2025-12-18","passed","2025-12-18","","62774 Visualizar Subactividades asociadas a una Actividad","",""
"","7488","CP03_Indicadores tarjetas visibles y valores","","2025-12-18","passed","2025-12-18","","58127 Creación de envío de alertas o notificación","",""
"","9576","CP3_Validar comportamiento botones crear actividad y subactividad","","2025-12-18","passed","2025-12-18","","58307 Administrar Actividades - Consulta de Actividades","",""
"","10300","CP01_Validar estructura de la pantalla","","2025-12-18","passed","2025-12-18","","58361 Administrar Pregunta por actividad o subactividad","",""
"","7166","CP06_Validar el botón de Crear alerta","","2025-12-18","passed","2025-12-18","","58105 Administrar envío de alertas o notificaciones - Consulta de alertas o notificaciones","",""
"","14239","CP12_Validar comportamiento botón Cancelar y botón Cerrar del form","","2025-12-18","passed","2025-12-18","","58379 Modificación de sub - actividad para una actividad","",""
"","8811","CP9_Validar que si existe un campo vacio no guarde el registro","","2025-12-18","passed","2025-12-18","","58310 Modificación de Actividad por etapa","",""
"","8164","CP02_Estructura visual formulario creación","","2025-12-18","passed","2025-12-18","","58363 Creación de pregunta por actividad o subactividad","",""
"","11719","CP01_Acceso a la pantalla ""Administrar Etapa del Proceso Electoral","","2025-12-18","passed","2025-12-18","","58289 Administrar Etapa del Proceso electoral - Consulta de etapa proceso electoral","",""
"","10281","CP13_Validar campos obligatorios de formulario","","2025-12-18","passed","2025-12-18","","58363 Creación de pregunta por actividad o subactividad","",""
"","13753","CP18_Cancelar creación pregunta","","2025-12-18","passed","2025-12-18","","58363 Creación de pregunta por actividad o subactividad","",""
"","8010","CP02_Estructura de la pantalla ""Cargue Archivos Basicos""","","2025-12-18","passed","2025-12-18","","62750 Cargue de Archivo de Agrupaciones Políticas","",""
"","12850","CP08_Acciones en la grilla","","2025-12-18","passed","2025-12-18","","58361 Administrar Pregunta por actividad o subactividad","",""
"","7493","CP3_Login exitoso redirección home","","2025-12-18","passed","2025-12-18","","57775 Autenticación de Usuarios mediante Login","",""
"","16491","CP16_Envío por SMS cuando check activado","","2025-12-18","passed","2025-12-18","","58127 Creación de envío de alertas o notificación","",""
"","11172","CP01_Visualización del formulario de creación de etapa","","2025-12-18","passed","2025-12-18","","58291 Creación de etapa del proceso electoral","",""
